{
  "schema_version": 1,
  "as_of_date": "2026-09-28",
  "processor_inventory_status": "complete",
  "processors": [
    {"processor_id": "first-party-service", "inventory_status": "identified", "evidence_refs": ["ev-map"]},
    {"processor_id": "synthetic-vendor", "inventory_status": "identified", "evidence_refs": ["ev-vendor"]}
  ],
  "evidence_refs": [
    {"evidence_ref_id": "ev-map", "sha256": "aaaaaaaaaaaaaaaaaaaaaaaaaaaaaaaaaaaaaaaaaaaaaaaaaaaaaaaaaaaaaaaa", "observed_on": "2026-09-20"},
    {"evidence_ref_id": "ev-vendor", "sha256": "bbbbbbbbbbbbbbbbbbbbbbbbbbbbbbbbbbbbbbbbbbbbbbbbbbbbbbbbbbbbbbbb", "observed_on": "2026-09-21"},
    {"evidence_ref_id": "ev-consent", "sha256": "cccccccccccccccccccccccccccccccccccccccccccccccccccccccccccccccc", "observed_on": "2026-09-22"},
    {"evidence_ref_id": "ev-retention", "sha256": "dddddddddddddddddddddddddddddddddddddddddddddddddddddddddddddddd", "observed_on": "2026-09-22"},
    {"evidence_ref_id": "ev-delete", "sha256": "eeeeeeeeeeeeeeeeeeeeeeeeeeeeeeeeeeeeeeeeeeeeeeeeeeeeeeeeeeeeeeee", "observed_on": "2026-09-24"},
    {"evidence_ref_id": "ev-pia", "sha256": "ffffffffffffffffffffffffffffffffffffffffffffffffffffffffffffffff", "observed_on": "2026-09-22"}
  ],
  "products": [
    {
      "product_id": "synthetic-product",
      "inventory_status": "complete",
      "consent_status": "documented",
      "consent_evidence_refs": ["ev-consent"],
      "retention_status": "documented",
      "retention_evidence_refs": ["ev-retention"],
      "deletion_test_status": "passed",
      "deletion_tested_on": "2026-09-24",
      "deletion_evidence_refs": ["ev-delete"],
      "pia_status": "completed",
      "pia_evidence_refs": ["ev-pia"],
      "data_flows": [
        {"flow_id": "synthetic-flow", "processor_id": "synthetic-vendor", "purpose_id": "purpose-synthetic", "data_categories": ["account_profile"], "evidence_refs": ["ev-map", "ev-vendor"]}
      ]
    }
  ]
}
